{
  "$schema": "https://json-schema.org/draft/2020-12/schema",
  "title": "EventEnvelope",
  "type": "object",
  "additionalProperties": false,
  "required": [
    "eventId",
    "eventType",
    "schemaVersion",
    "aggregateId",
    "occurredAt",
    "correlationId",
    "causationId",
    "payload"
  ],
  "properties": {
    "eventId": {
      "type": "string",
      "format": "uuid"
    },
    "eventType": {
      "type": "string",
      "minLength": 1
    },
    "schemaVersion": {
      "type": "integer",
      "minimum": 1
    },
    "aggregateId": {
      "type": "string",
      "format": "uuid"
    },
    "occurredAt": {
      "type": "string",
      "format": "date-time"
    },
    "correlationId": {
      "type": "string",
      "format": "uuid"
    },
    "causationId": {
      "type": ["string", "null"],
      "format": "uuid"
    },
    "payload": {
      "type": "object"
    }
  }
}
