{
  "eventId": "e1000000-0000-4000-8000-000000000001",
  "eventType": "claim.analysis.requested",
  "schemaVersion": 1,
  "aggregateId": "c2000000-0000-4000-8000-000000000001",
  "occurredAt": "2026-10-01T12:00:00Z",
  "correlationId": "d3000000-0000-4000-8000-000000000001",
  "causationId": null,
  "payload": {
    "claimId": "c2000000-0000-4000-8000-000000000001",
    "claimedAmount": "4000.00"
  }
}
