{
  "eventId": "a1000000-0000-4000-8000-000000000021",
  "eventType": "claim.decided",
  "schemaVersion": 1,
  "aggregateId": "b2000000-0000-4000-8000-000000000021",
  "occurredAt": "2026-10-01T13:00:00Z",
  "correlationId": "c3000000-0000-4000-8000-000000000021",
  "causationId": "a1000000-0000-4000-8000-000000000011",
  "payload": {
    "claimId": "b2000000-0000-4000-8000-000000000021",
    "policyNumber": "SYN-AUTO-1021",
    "decision": "approved",
    "decidedAt": "2026-10-01T13:00:00Z",
    "decidedBy": "system-rules",
    "approvedAmount": "4500.00",
    "reason": null
  }
}
