{
  "eventId": "a1000000-0000-4000-8000-000000000031",
  "eventType": "settlement.simulated",
  "schemaVersion": 1,
  "aggregateId": "b2000000-0000-4000-8000-000000000031",
  "occurredAt": "2026-10-01T14:00:00Z",
  "correlationId": "c3000000-0000-4000-8000-000000000031",
  "causationId": "a1000000-0000-4000-8000-000000000021",
  "payload": {
    "claimId": "b2000000-0000-4000-8000-000000000031",
    "settlementId": "e5000000-0000-4000-8000-000000000031",
    "policyNumber": "SYN-AUTO-1031",
    "paidAmount": "4500.00",
    "settledAt": "2026-10-01T14:00:00Z"
  }
}
